{
  "chunk_id": "vc-4a9bf2c81e7d",
  "object_id": "fair:socioprophet:doc:patient-summary-2026-08-04:sha256:a3c5e8f2",
  "embedding_ref": "ec-7d3a1f9e2b84",
  "scope": {
    "topic_set": ["medical.cardiology", "patient.rx", "clinical.summary"],
    "domain": "medical",
    "span": { "start": 0, "end": 512 }
  },
  "indexed_at": "2026-08-04T18:00:00Z",
  "vector_dim": 1536,
  "collection_ref": "memoryd-medical-v1"
}
